### ISSUE TITLE
Stuck on Waiting for VM to boot. 

### ISSUE THREAD

**Issue by afiune** [WinRb/vagrant-windows#194]
I would like to open this issue to expose that we have been having issues with the plugin because it get stuck on the process to wait for the VM to boot. 

```
       [default] Waiting for VM to boot. This can take a few minutes.
```

I know that behind the scenes the plugin is running a simple `powershell` script to get the `hostname` and when debugging we got this kind of errors:

```
<WinRM::WinRMHTTPTransportError: Bad HTTP response returned from server (403).>
```

And 

```
<WinRM::WinRMHTTPTransportError: Bad HTTP response returned from server (504).>
```

We have tried a lot of possible solutions and somethings it get solved but some others don't. We really want to understand what is happening and what we can do to avoid this issue in the future.

We already did:
- Don't use any proxy.
- Disconnect from our VPN.
- Uninstall/Install the plugin again.
- Ensure that the Windows Guest has IIS, PowerShell, WinRM services and all the recommendations installed and well configured.
- Validate that WinRM communication works between the Host & Guest by running some commands against the box.
- Increase timeouts... (not sure this would works but we tried, haa)

Thanks in advance for any help provided...

**Comment by chiriaev** [comment]
Hi. Are you 100% sure that Vagrant/WinRM tries to get, and gets, to your server? In other words, have you traced the network when your VM boots?

**Comment by afiune** [comment]
I am 100% sure that Vagrant/WinRM tries to get to my VM... and 100% sure that it does not gets there.. (with the errors described above)

It actually set the right forwarding ports (validated connecting to the box manually) but when  Vagrant/WinRM launch the powershell to check that the VM has booted it get stuck there.. 

Debugging:

```
DEBUG subprocess: Waiting for process to exit. Remaining to timeout: 32000
DEBUG subprocess: Exit status: 0
DEBUG virtualbox_4_2:   - [1, "rdp", 3389, 3389]
DEBUG virtualbox_4_2:   - [1, "ssh", 2222, 22]
DEBUG virtualbox_4_2:   - [1, "winrm", 5985, 5985]
DEBUG winrmshell: initializing WinRMShell
DEBUG winrmshell: powershell executing:
hostname
 INFO winrmshell: Attempting to connect to WinRM...
 INFO winrmshell:   - Host: 127.0.0.1
 INFO winrmshell:   - Port: 5985
 INFO winrmshell:   - Username: vagrant
<WinRM::WinRMHTTPTransportError: Bad HTTP response returned from server (504).>
<WinRM::WinRMHTTPTransportError: Bad HTTP response returned from server (504).>
```

Need some ideas guys!! Will appreciated!! Thanks!!

**Comment by StevenArmstrong** [comment]
Okay when using this I have found that it boots faster if you use an ip as opposed to computer name as the winrm.host. Also the spec of your vsphere instance makes a difference, if you don't have a decent amount of memory available on the vsphere host it can take up to 30 minutes for winrm to start where if the memory is good then it is almost instant.

**Comment by sneal** [comment]
Is the WinRM service set to auto-start or delay-start on your guest? Running winrm commands from the command line will reset this value, so it may have been reset without your knowledge.

**Comment by afiune** [comment]
Thanks @StevenArmstrong I think it is not the case since the VM boots in 5 min. I am using VirtualBox and I have good memory configured. 

@sneal Thats correct, I have WinRM service set to auto-start. I have validated that it is up and running each time I spin up a new VM. Actually I run WinRM commands from the HOST against the Guest VM (while vagrant is waiting to detect that the VM is booted) and it works.. So I assume the configuration on the GUEST VM is all good.. I think the plugin is getting stuck somewhere.. I am still troubleshooting this.. Any help is really important to me! Thanks..

**Comment by afiune** [comment]
I have uninstalled everything.. Then installed again (Vagrant and their plugins) and give it a try. Sadly same situation:

When running `vagrant up` on debugging mode it gets stuck in the same point:

```
DEBUG subprocess: Waiting for process to exit. Remaining to timeout: 32000
DEBUG subprocess: Exit status: 0
DEBUG virtualbox_4_2:   - [1, "rdp", 3389, 3389]
DEBUG virtualbox_4_2:   - [1, "ssh", 2222, 22]
DEBUG virtualbox_4_2:   - [1, "winrm", 5985, 5985]
DEBUG winrmshell: initializing WinRMShell
DEBUG winrmshell: powershell executing:
hostname
 INFO winrmshell: Attempting to connect to WinRM...
 INFO winrmshell:   - Host: 127.0.0.1
 INFO winrmshell:   - Port: 5985
 INFO winrmshell:   - Username: vagrant
 INFO retryable: Retryable exception raised: #<WinRM::WinRMHTTPTransportError: Bad HTTP response returned from server (504).>
DEBUG winrmshell: powershell executing:
hostname
 INFO retryable: Retryable exception raised: #<WinRM::WinRMHTTPTransportError: Bad HTTP response returned from server (504).>
DEBUG winrmshell: powershell executing:
hostname
 INFO retryable: Retryable exception raised: #<WinRM::WinRMHTTPTransportError: Bad HTTP response returned from server (504).>
DEBUG winrmshell: powershell executing:
hostname
 INFO retryable: Retryable exception raised: #<WinRM::WinRMHTTPTransportError: Bad HTTP response returned from server (504).>
DEBUG winrmshell: powershell executing:
hostname
```

But while `vagrant` is retrying I opened another terminal and run same command `hostname` using `knife-windows` plugin:

```
~/repo $knife winrm localhost hostname -m -x vagrant -P vagrant
localhost TRSTWDVXXXAPP99
~/repo $
```

So conclusion is that I can reach the VM manually but Vagrant/WinRM is not.. 

Any idea?

**Comment by StevenArmstrong** [comment]
What user is your vagrant command running from? Is it a different user to the one you are using the command line from. Are you using a tool to schedule the vagrant up that is running under a service account? Also try specifying localhost in your vagrantfile as opposed to 127.0.0.1, does your hosts file have that 127.0.0.1 set to localhost? That may be the issue.

**Comment by afiune** [comment]
@StevenArmstrong same user.. And yes my user on my mac is different, it is not `vagrant` but I don't think it matters..

**Comment by sneal** [comment]
If this is windows on windows, maybe the port isn't getting forwarded properly and the plugin is actually hitting your host and not the guest? Try another host port and see if that changes behavior at all:

`config.vm.network "forwarded_port", guest: 5985, host: 15985`

**Comment by sneal** [comment]
I didn't see you last couple of posts, so ^ probably not the issue...

**Comment by juliandunn** [comment]
You don't happen to have any `HTTP_PROXY`, `HTTPS_PROXY`, etc. environmental variables set? I have burned myself quite a few times with this sort of thing, as Vagrant will read and use those.

**Comment by afiune** [comment]
@Juliandunn that is correct. I do have those environment variable loaded. I thought that was the problem so I already changed three different proxies on my organization without any luck. Additionally I unset them (unload them from the environment on my terminal) and got the same exact problem... 

Really weird!!!

This is driving me crazy!  Thanks for your ideas at the moment.. Keep helping please.. I'm still troubleshooting as well.

**Comment by juliandunn** [comment]
Can you `tcpdump` (or use Wireshark) the outgoing traffic from your workstation to ensure that it really is not going to the proxy?

**Comment by sneal** [comment]
@afiune What OS and version of WinRM is running on the guest? I wonder if #148 applies here?

**Comment by afiune** [comment]
Interesting @juliandunn... I used `tcpdump` and watch the `port 5985` and guess what? When Vagrant/WinRM attempt to connect:

```
 INFO winrmshell: Attempting to connect to WinRM...
 INFO winrmshell:   - Host: 127.0.0.1
 INFO winrmshell:   - Port: 5985
 INFO winrmshell:   - Username: vagrant
```

It does not connect or show any value that indicates that it is trying to connect!!! 

But when I use the `knife winrm` command it does connect and does show values on the `tcpdump`.. 

```
10:13:47.968819 IP localhost.50447 > localhost.wsman: Flags [S], seq 4185529570, win 65535, options [mss 16344,nop,wscale 4,nop,nop,TS val 573981885 ecr 0,sackOK,eol], length 0
10:13:47.968932 IP localhost.wsman > localhost.50447: Flags [S.], seq 55269389, ack 4185529571, win 65535, options [mss 16344,nop,wscale 3,nop,nop,TS val 573981885 ecr 573981885,sackOK,eol], length 0
10:13:47.968941 IP localhost.50447 > localhost.wsman: Flags [.], ack 1, win 9186, options [nop,nop,TS val 573981885 ecr 573981885], length 0
10:13:47.968951 IP localhost.wsman > localhost.50447: Flags [.], ack 1, win 26539, options [nop,nop,TS val 573981885 ecr 573981885], length 0
10:13:47.969278 IP localhost.50447 > localhost.wsman: Flags [P.], seq 1:513, ack 1, win 9186, options [nop,nop,TS val 573981885 ecr 573981885], length 512 10 
```

I'm going to try playing with my `/etc/hosts` file.. Any other idea? 

Thanks again guys!!!

**Comment by afiune** [comment]
I have an idea! Is there a way to tell Vagrant/WinRM to use `localhost` instead of `127.0.0.1` ???

**Comment by sneal** [comment]
Heh, I was thinking the same thing. Try `config.winrm.host = 'localhost'`

**Comment by afiune** [comment]
Works!!! :+1:

**Comment by afiune** [comment]
Guys really appreciate the help!!

**Comment by dragon788** [comment]
Thanks for the localhost comment, this fixed my issue running vagrant against the modern.ie boxes in Linux. Without config.winrm.host = 'localhost' it didn't work.
